{
  "eras": [
    {
      "description": "The first three IPL editions.",
      "eraId": "era-foundation",
      "label": "Foundation Era",
      "notes": [],
      "seasonIds": [
        "ipl-2008",
        "ipl-2009",
        "ipl-2010"
      ],
      "status": "provisional"
    },
    {
      "description": "The provisional expansion-era grouping.",
      "eraId": "era-expansion",
      "label": "Expansion Era",
      "notes": [],
      "seasonIds": [
        "ipl-2011",
        "ipl-2012",
        "ipl-2013"
      ],
      "status": "provisional"
    },
    {
      "description": "The provisional transition-era grouping.",
      "eraId": "era-transition",
      "label": "Transition Era",
      "notes": [],
      "seasonIds": [
        "ipl-2014",
        "ipl-2015",
        "ipl-2016",
        "ipl-2017"
      ],
      "status": "provisional"
    },
    {
      "description": "Modern IPL seasons before the Impact Player era.",
      "eraId": "era-modern-pre-impact",
      "label": "Modern Pre-Impact Era",
      "notes": [],
      "seasonIds": [
        "ipl-2018",
        "ipl-2019",
        "ipl-2020",
        "ipl-2021",
        "ipl-2022"
      ],
      "status": "provisional"
    },
    {
      "description": "Completed editions in the provisional Impact Player era.",
      "eraId": "era-impact",
      "label": "Impact Era",
      "notes": [
        "Later editions are added only through an explicit registry update."
      ],
      "seasonIds": [
        "ipl-2023",
        "ipl-2024",
        "ipl-2025",
        "ipl-2026"
      ],
      "status": "provisional"
    }
  ],
  "registryVersion": "ipl-identities-v1",
  "schemaVersion": "1.0.0",
  "sourceArchiveManifestHash": "c61f75f3facac0f72e126fd611cdf6afed7da875d628ae62338cba1d5380cbf7"
}
